{
  "version": "0.1",
  "status": "active",
  "authority": "PO",
  "updated": "2026-08-01",
  "note": "全現役成果物の権威正本。canonical=正本／view=生成ビュー、authority_format で正本の形式を、authority_status（現役導線上の位置）と lifecycle_status（内容成熟度）を分離して持つ。",
  "items": [
    {
      "artifact_id": "AUTH-ADR-ADR-001-PYTHON-SINGLE-LAYER",
      "layer": "00-authority",
      "slice": "cross",
      "domain": "adr",
      "artifact_type": "adr",
      "authority_format": "markdown",
      "authority_status": "active",
      "lifecycle_status": "draft",
      "canonical_path": "docs/00-authority/adr/ADR-001-python-single-layer.md",
      "view_path": null,
      "view_generation": "none",
      "pair_artifact_id": null,
      "supersedes": [],
      "extends_artifact_ids": [],
      "depends_on_artifact_ids": [],
      "previous_paths": [
        "docs/governance/adr/ADR-001-python-single-layer.md"
      ],
      "approval_digest": null,
      "review_digest": null
    },
    {
      "artifact_id": "AUTH-ADR-ADR-002-CONNECTION-PRIORITY",
      "layer": "00-authority",
      "slice": "cross",
      "domain": "adr",
      "artifact_type": "adr",
      "authority_format": "markdown",
      "authority_status": "active",
      "lifecycle_status": "draft",
      "canonical_path": "docs/00-authority/adr/ADR-002-connection-priority.md",
      "view_path": null,
      "view_generation": "none",
      "pair_artifact_id": null,
      "supersedes": [],
      "extends_artifact_ids": [],
      "depends_on_artifact_ids": [],
      "previous_paths": [
        "docs/governance/adr/ADR-002-connection-priority.md"
      ],
      "approval_digest": null,
      "review_digest": null
    },
    {
      "artifact_id": "AUTH-ADR-ADR-003-BROWSER-THREE-TIER",
      "layer": "00-authority",
      "slice": "cross",
      "domain": "adr",
      "artifact_type": "adr",
      "authority_format": "markdown",
      "authority_status": "active",
      "lifecycle_status": "draft",
      "canonical_path": "docs/00-authority/adr/ADR-003-browser-three-tier.md",
      "view_path": null,
      "view_generation": "none",
      "pair_artifact_id": null,
      "supersedes": [],
      "extends_artifact_ids": [],
      "depends_on_artifact_ids": [],
      "previous_paths": [
        "docs/governance/adr/ADR-003-browser-three-tier.md"
      ],
      "approval_digest": null,
      "review_digest": null
    },
    {
      "artifact_id": "AUTH-ADR-ADR-004-DATA-AUTHORITY",
      "layer": "00-authority",
      "slice": "cross",
      "domain": "adr",
      "artifact_type": "adr",
      "authority_format": "markdown",
      "authority_status": "active",
      "lifecycle_status": "draft",
      "canonical_path": "docs/00-authority/adr/ADR-004-data-authority.md",
      "view_path": null,
      "view_generation": "none",
      "pair_artifact_id": null,
      "supersedes": [],
      "extends_artifact_ids": [],
      "depends_on_artifact_ids": [],
      "previous_paths": [
        "docs/governance/adr/ADR-004-data-authority.md"
      ],
      "approval_digest": null,
      "review_digest": null
    },
    {
      "artifact_id": "AUTH-ADR-ADR-005-WP-REST-DIRECT",
      "layer": "00-authority",
      "slice": "cross",
      "domain": "adr",
      "artifact_type": "adr",
      "authority_format": "markdown",
      "authority_status": "active",
      "lifecycle_status": "draft",
      "canonical_path": "docs/00-authority/adr/ADR-005-wp-rest-direct.md",
      "view_path": null,
      "view_generation": "none",
      "pair_artifact_id": null,
      "supersedes": [],
      "extends_artifact_ids": [],
      "depends_on_artifact_ids": [],
      "previous_paths": [
        "docs/governance/adr/ADR-005-wp-rest-direct.md"
      ],
      "approval_digest": null,
      "review_digest": null
    },
    {
      "artifact_id": "AUTH-ADR-ADR-006-OFFICIAL-API-ROUTES",
      "layer": "00-authority",
      "slice": "cross",
      "domain": "adr",
      "artifact_type": "adr",
      "authority_format": "markdown",
      "authority_status": "active",
      "lifecycle_status": "draft",
      "canonical_path": "docs/00-authority/adr/ADR-006-official-api-routes.md",
      "view_path": null,
      "view_generation": "none",
      "pair_artifact_id": null,
      "supersedes": [],
      "extends_artifact_ids": [],
      "depends_on_artifact_ids": [],
      "previous_paths": [
        "docs/governance/adr/ADR-006-official-api-routes.md"
      ],
      "approval_digest": null,
      "review_digest": null
    },
    {
      "artifact_id": "AUTH-AUDIT-CROSS-REPOSITORY-WRITE-INCIDENT-2026-08-01",
      "layer": "00-authority",
      "slice": "cross",
      "domain": "audits",
      "artifact_type": "audit-record",
      "authority_format": "markdown",
      "authority_status": "active",
      "lifecycle_status": "completed",
      "canonical_path": "docs/00-authority/audits/cross-repository-write-incident-2026-08-01.md",
      "view_path": null,
      "view_generation": "none",
      "pair_artifact_id": null,
      "supersedes": [],
      "extends_artifact_ids": [],
      "depends_on_artifact_ids": [],
      "previous_paths": [
        "docs/governance/helix-intake-2026-08-01.md"
      ],
      "approval_digest": null,
      "review_digest": null
    },
    {
      "artifact_id": "AUTH-AUDIT-GRANULARITY-GAP-AUDIT-V0-1",
      "layer": "00-authority",
      "slice": "cross",
      "domain": "audits",
      "artifact_type": "audit-record",
      "authority_format": "markdown",
      "authority_status": "active",
      "lifecycle_status": "completed",
      "canonical_path": "docs/00-authority/audits/granularity-gap-audit-v0.1.md",
      "view_path": null,
      "view_generation": "none",
      "pair_artifact_id": null,
      "supersedes": [],
      "extends_artifact_ids": [],
      "depends_on_artifact_ids": [],
      "previous_paths": [
        "docs/governance/granularity-gap-audit-v0.1.md"
      ],
      "approval_digest": null,
      "review_digest": null
    },
    {
      "artifact_id": "AUTH-AUDIT-GRANULARITY-GAP-AUDIT",
      "layer": "00-authority",
      "slice": "cross",
      "domain": "audits",
      "artifact_type": "catalog",
      "authority_format": "json",
      "authority_status": "active",
      "lifecycle_status": "draft",
      "canonical_path": "docs/00-authority/audits/granularity-gap-audit.json",
      "view_path": null,
      "view_generation": "none",
      "pair_artifact_id": null,
      "supersedes": [],
      "extends_artifact_ids": [],
      "depends_on_artifact_ids": [],
      "previous_paths": [
        "docs/governance/json/granularity-gap-audit.json"
      ],
      "approval_digest": null,
      "review_digest": null
    },
    {
      "artifact_id": "AUTH-AUDIT-REQUIREMENTS-GAP-AUDIT-2026-07-30",
      "layer": "00-authority",
      "slice": "cross",
      "domain": "audits",
      "artifact_type": "audit-record",
      "authority_format": "markdown",
      "authority_status": "active",
      "lifecycle_status": "completed",
      "canonical_path": "docs/00-authority/audits/requirements-gap-audit-2026-07-30.md",
      "view_path": null,
      "view_generation": "none",
      "pair_artifact_id": null,
      "supersedes": [],
      "extends_artifact_ids": [],
      "depends_on_artifact_ids": [],
      "previous_paths": [
        "docs/governance/requirements-gap-audit-2026-07-30.md"
      ],
      "approval_digest": null,
      "review_digest": null
    },
    {
      "artifact_id": "AUTH-AUDIT-REVIEW-REMEDIATION-2026-08-01",
      "layer": "00-authority",
      "slice": "cross",
      "domain": "audits",
      "artifact_type": "audit-record",
      "authority_format": "markdown",
      "authority_status": "active",
      "lifecycle_status": "draft",
      "canonical_path": "docs/00-authority/audits/review-remediation-2026-08-01.md",
      "view_path": null,
      "view_generation": "none",
      "pair_artifact_id": null,
      "supersedes": [],
      "extends_artifact_ids": [],
      "depends_on_artifact_ids": [],
      "previous_paths": [
        "docs/governance/review-remediation-2026-08-01.md"
      ],
      "approval_digest": null,
      "review_digest": null
    },
    {
      "artifact_id": "AUTH-AUDIT-S0-DESIGN-INPUT-AUDIT-2026-08-01",
      "layer": "00-authority",
      "slice": "cross",
      "domain": "audits",
      "artifact_type": "audit-record",
      "authority_format": "markdown",
      "authority_status": "active",
      "lifecycle_status": "completed",
      "canonical_path": "docs/00-authority/audits/s0-design-input-audit-2026-08-01.md",
      "view_path": null,
      "view_generation": "none",
      "pair_artifact_id": null,
      "supersedes": [],
      "extends_artifact_ids": [],
      "depends_on_artifact_ids": [],
      "previous_paths": [],
      "approval_digest": null,
      "review_digest": null
    },
    {
      "artifact_id": "AUTH-REQUIREMENTS-GATES",
      "layer": "00-authority",
      "slice": "cross",
      "domain": "authority",
      "artifact_type": "policy",
      "authority_format": "markdown",
      "authority_status": "active",
      "lifecycle_status": "draft",
      "canonical_path": "docs/00-authority/requirements-gates.md",
      "view_path": null,
      "view_generation": "none",
      "pair_artifact_id": null,
      "supersedes": [],
      "extends_artifact_ids": [],
      "depends_on_artifact_ids": [],
      "previous_paths": [
        "docs/governance/requirements-gates.md"
      ],
      "approval_digest": null,
      "review_digest": null
    },
    {
      "artifact_id": "AUTH-RISK-REGISTER",
      "layer": "00-authority",
      "slice": "cross",
      "domain": "authority",
      "artifact_type": "policy",
      "authority_format": "markdown",
      "authority_status": "active",
      "lifecycle_status": "draft",
      "canonical_path": "docs/00-authority/risk-register_v0.1.md",
      "view_path": null,
      "view_generation": "none",
      "pair_artifact_id": null,
      "supersedes": [],
      "extends_artifact_ids": [],